{
  "$schema":"https://json-schema.org/draft/2020-12/schema","$id":"deck-prompt-package.schema.json","title":"P3.2 Deck Prompt Package","type":"object","additionalProperties":false,
  "required":["schema_version","artifact_type","deck_id","deck_visual_system_sha256","text_footprint_manifest_sha256","deck_request_sha256","approved_outline_sha256","slide_content_manifest_sha256","p2_manifest_sha256","p3_icon_asset_index_sha256","generation_policy","shared_prompt","negative_prompt","style_anchor_slide_id","high_risk_slide_ids","slides","status"],
  "properties":{"schema_version":{"const":"1.0"},"artifact_type":{"const":"deck_prompt_package"},"deck_id":{"type":"string","minLength":1},"deck_visual_system_sha256":{"$ref":"#/$defs/hash"},"text_footprint_manifest_sha256":{"$ref":"#/$defs/hash"},"deck_request_sha256":{"$ref":"#/$defs/hash"},"approved_outline_sha256":{"$ref":"#/$defs/hash"},"slide_content_manifest_sha256":{"$ref":"#/$defs/hash"},"p2_manifest_sha256":{"$ref":"#/$defs/hash"},"p3_icon_asset_index_sha256":{"$ref":"#/$defs/hash"},"generation_policy":{"type":"object","additionalProperties":false,"required":["provider_policy","model_policy","initial_generation_limit","technical_retry_limit"],"properties":{"provider_policy":{"const":"runtime_default"},"model_policy":{"const":"runtime_default"},"initial_generation_limit":{"const":1},"technical_retry_limit":{"const":2}}},"shared_prompt":{"type":"string","minLength":1},"negative_prompt":{"type":"string","minLength":1},"style_anchor_slide_id":{"type":"string","minLength":1},"high_risk_slide_ids":{"type":"array","uniqueItems":true,"items":{"type":"string","minLength":1}},"slides":{"type":"array","minItems":1,"items":{"$ref":"#/$defs/slide"}},"status":{"const":"compiled"}},
  "$defs":{"hash":{"type":"string","pattern":"^[a-f0-9]{64}$"},"intent":{"type":"object","additionalProperties":false,"required":["source_ref","element_owner","render_policy","footprint_ref","future_element_map_id"],"properties":{"source_ref":{"type":"string","minLength":1},"element_owner":{"enum":["deterministic_compositor","generated_visual_layer"]},"render_policy":{"enum":["formal_text_overlay","resolved_svg_overlay","chart_preview_overlay","generated_image","generated_illustration","generated_diagram_structure","generated_extraction_candidate"]},"footprint_ref":{"oneOf":[{"type":"string","minLength":1},{"type":"null"}]},"future_element_map_id":{"type":"string","minLength":1}}},"slide":{"type":"object","additionalProperties":false,"required":["slide_id","order","role","template_family","prompt_input_sha256","prompt_sha256","prompt","element_intents","reused"],"properties":{"slide_id":{"type":"string","minLength":1},"order":{"type":"integer","minimum":1,"maximum":100},"role":{"type":"string","minLength":1},"template_family":{"type":"string","minLength":1},"prompt_input_sha256":{"$ref":"#/$defs/hash"},"prompt_sha256":{"$ref":"#/$defs/hash"},"prompt":{"type":"string","minLength":1},"element_intents":{"type":"array","minItems":1,"items":{"$ref":"#/$defs/intent"}},"reused":{"type":"boolean"}}}}
}
