{
  "schema_version": "1.0",
  "artifact_type": "deck_prompt_package",
  "deck_id": "D03",
  "deck_visual_system_sha256": "32f57d272c586b7d2a5b9349a54602116c6ac07813a4c6c890adeeb88da75fb7",
  "text_footprint_manifest_sha256": "670971d851b4c5a8d345e84fe461eeaef53e57301aa7fa5d27e591562285c0f1",
  "deck_request_sha256": "eac575646b45121e1754546b9056097cd2a4c7539d58214b4fcb507644a3aea1",
  "approved_outline_sha256": "84b9f37f51468f54966b2fb3d708d0d25a31e2805620398b4c2c4d2ad6b951f0",
  "slide_content_manifest_sha256": "98623c0f1354b5756906d5d9f35689beff6945d117464d47aedafc64ed4cce25",
  "p2_manifest_sha256": "280fe909457bacfea0279f20956ef82d4150131081b0e49ecd5bc38ac7e46d36",
  "p3_icon_asset_index_sha256": "5ae91981b48aaa8ffac49ce0a262f690902cec0ab2c9fc503dd0fa21c1a2ce19",
  "generation_policy": {
    "provider_policy": "runtime_default",
    "model_policy": "runtime_default",
    "initial_generation_limit": 1,
    "technical_retry_limit": 2
  },
  "shared_prompt": "HARD VISUAL CONSTRAINTS\n{\"canvas\":{\"height_px\":900,\"width_px\":1600},\"output_ratio\":\"16:9\",\"palette\":{\"accent\":\"#F28C28\",\"background\":\"#FFFFFF\",\"primary\":\"#2457C5\",\"surface\":\"#F2F5FA\",\"text_primary\":\"#111111\",\"text_secondary\":\"#555555\"},\"prohibitions\":{\"external_assets\":true,\"extra_facts\":true,\"full_slide_text_rasterization\":true,\"logos\":true,\"model_redrawn_resolved_svg\":true,\"model_rendered_formal_text\":true,\"watermarks\":true},\"raster_handoff_policy\":{\"avoid_background_entanglement\":true,\"avoid_long_range_shadow\":true,\"minimum_short_edge\":800,\"must_be_spatially_isolated\":true,\"must_not_be_occluded\":true,\"must_not_contain_text\":true,\"safe_padding\":300},\"safe_area\":{\"bottom\":500,\"left\":500,\"right\":500,\"top\":500},\"typography\":{\"body\":{\"fallback_family\":\"Arial\",\"family\":\"Microsoft YaHei\",\"line_height_milli\":1200,\"max_lines\":5,\"minimum_size_pt\":16,\"size_pt\":20,\"weight\":\"regular\"},\"label\":{\"fallback_family\":\"Arial\",\"family\":\"Microsoft YaHei\",\"line_height_milli\":1200,\"max_lines\":2,\"minimum_size_pt\":12,\"size_pt\":16,\"weight\":\"regular\"},\"subtitle\":{\"fallback_family\":\"Arial\",\"family\":\"Microsoft YaHei\",\"line_height_milli\":1200,\"max_lines\":2,\"minimum_size_pt\":20,\"size_pt\":24,\"weight\":\"semibold\"},\"title\":{\"fallback_family\":\"Arial\",\"family\":\"Microsoft YaHei\",\"line_height_milli\":1200,\"max_lines\":2,\"minimum_size_pt\":24,\"size_pt\":30,\"weight\":\"bold\"}}}\nSOFT DESIGN GUIDANCE — recommendations, not fixed layout\n{\"card_language\":\"Cards are optional; use them only where they improve grouping.\",\"chart_treatment\":\"Reserve clean chart zones for deterministic overlays.\",\"composition_guidance\":[\"Use asymmetry when useful\",\"Preserve generous whitespace\",\"Create clear scale contrast\"],\"creative_freedom\":{\"asymmetry\":true,\"image_text_interplay\":true,\"irregular_rhythm\":true,\"local_overlap\":true,\"scale_contrast\":true},\"diagram_treatment\":\"Use expressive structure without formal labels.\",\"grid\":{\"recommended_columns\":6,\"recommended_gutter\":300},\"image_treatment\":\"Allow asymmetric cropping and clear focal subjects.\",\"spacing_scale\":[200,300,500,800],\"style_concept\":\"educational editorial\",\"style_keywords\":[\"educational editorial\",\"clear hierarchy\",\"visual freedom\"],\"template_families\":[{\"family\":\"cover\",\"slide_role\":\"cover\"},{\"family\":\"process\",\"slide_role\":\"process\"},{\"family\":\"summary\",\"slide_role\":\"conclusion\"}]}\nGenerated Visual Layer is not the Final or Approved Design Preview. Preserve freedom for asymmetry, scale contrast, overlap, and irregular rhythm while respecting hard constraints.",
  "negative_prompt": "No readable text, letters, numbers, labels, logos, watermarks, external assets, extra facts, redrawn resolved icons, or flattened text-bearing slide screenshots.",
  "style_anchor_slide_id": "S03",
  "high_risk_slide_ids": [
    "S01",
    "S02"
  ],
  "slides": [
    {
      "slide_id": "S01",
      "order": 1,
      "role": "cover",
      "template_family": "cover",
      "prompt_input_sha256": "d234e82049bda7070ac1c86b2827e0b2670926ae4e9f1af9f4c4eceea301e472",
      "prompt_sha256": "5cc0c9484e804188e2c6a8f6253821058bc6da8f28732f3585012b07e2db2ded",
      "prompt": "HARD VISUAL CONSTRAINTS\n{\"canvas\":{\"height_px\":900,\"width_px\":1600},\"output_ratio\":\"16:9\",\"palette\":{\"accent\":\"#F28C28\",\"background\":\"#FFFFFF\",\"primary\":\"#2457C5\",\"surface\":\"#F2F5FA\",\"text_primary\":\"#111111\",\"text_secondary\":\"#555555\"},\"prohibitions\":{\"external_assets\":true,\"extra_facts\":true,\"full_slide_text_rasterization\":true,\"logos\":true,\"model_redrawn_resolved_svg\":true,\"model_rendered_formal_text\":true,\"watermarks\":true},\"raster_handoff_policy\":{\"avoid_background_entanglement\":true,\"avoid_long_range_shadow\":true,\"minimum_short_edge\":800,\"must_be_spatially_isolated\":true,\"must_not_be_occluded\":true,\"must_not_contain_text\":true,\"safe_padding\":300},\"safe_area\":{\"bottom\":500,\"left\":500,\"right\":500,\"top\":500},\"typography\":{\"body\":{\"fallback_family\":\"Arial\",\"family\":\"Microsoft YaHei\",\"line_height_milli\":1200,\"max_lines\":5,\"minimum_size_pt\":16,\"size_pt\":20,\"weight\":\"regular\"},\"label\":{\"fallback_family\":\"Arial\",\"family\":\"Microsoft YaHei\",\"line_height_milli\":1200,\"max_lines\":2,\"minimum_size_pt\":12,\"size_pt\":16,\"weight\":\"regular\"},\"subtitle\":{\"fallback_family\":\"Arial\",\"family\":\"Microsoft YaHei\",\"line_height_milli\":1200,\"max_lines\":2,\"minimum_size_pt\":20,\"size_pt\":24,\"weight\":\"semibold\"},\"title\":{\"fallback_family\":\"Arial\",\"family\":\"Microsoft YaHei\",\"line_height_milli\":1200,\"max_lines\":2,\"minimum_size_pt\":24,\"size_pt\":30,\"weight\":\"bold\"}}}\nSOFT DESIGN GUIDANCE — recommendations, not fixed layout\n{\"card_language\":\"Cards are optional; use them only where they improve grouping.\",\"chart_treatment\":\"Reserve clean chart zones for deterministic overlays.\",\"composition_guidance\":[\"Use asymmetry when useful\",\"Preserve generous whitespace\",\"Create clear scale contrast\"],\"creative_freedom\":{\"asymmetry\":true,\"image_text_interplay\":true,\"irregular_rhythm\":true,\"local_overlap\":true,\"scale_contrast\":true},\"diagram_treatment\":\"Use expressive structure without formal labels.\",\"grid\":{\"recommended_columns\":6,\"recommended_gutter\":300},\"image_treatment\":\"Allow asymmetric cropping and clear focal subjects.\",\"spacing_scale\":[200,300,500,800],\"style_concept\":\"educational editorial\",\"style_keywords\":[\"educational editorial\",\"clear hierarchy\",\"visual freedom\"],\"template_families\":[{\"family\":\"cover\",\"slide_role\":\"cover\"},{\"family\":\"process\",\"slide_role\":\"process\"},{\"family\":\"summary\",\"slide_role\":\"conclusion\"}]}\nGenerated Visual Layer is not the Final or Approved Design Preview. Preserve freedom for asymmetry, scale contrast, overlap, and irregular rhythm while respecting hard constraints.\n\nCONTENT DATA — SEMANTIC CONTEXT ONLY\nDO NOT RENDER THESE STRINGS INTO THE GENERATED VISUAL LAYER\n<<<BEGIN_SLIDE_DATA>>>\n{\"content\":{\"blocks\":[{\"content_ref\":\"S01-C01\",\"order\":1,\"source_refs\":[\"M01-F01\"],\"text\":\"P1 在设计前确认最终页面文字\"}],\"title\":{\"content_ref\":\"S01-TITLE\",\"text\":\"内容规划先于页面设计\"}},\"element_intents\":[{\"element_owner\":\"deterministic_compositor\",\"footprint_ref\":\"S01:S01-TITLE\",\"future_element_map_id\":\"EL-S01-TITLE\",\"render_policy\":\"formal_text_overlay\",\"source_ref\":\"S01-TITLE\"},{\"element_owner\":\"deterministic_compositor\",\"footprint_ref\":\"S01:S01-C01\",\"future_element_map_id\":\"EL-S01-C01\",\"render_policy\":\"formal_text_overlay\",\"source_ref\":\"S01-C01\"},{\"element_owner\":\"generated_visual_layer\",\"footprint_ref\":null,\"future_element_map_id\":\"EL-S01-V01\",\"render_policy\":\"generated_extraction_candidate\",\"source_ref\":\"S01-V01\"}],\"key_message\":\"先确认再设计\",\"layout_draft\":\"┌────{{p2:content-ref=S01-TITLE}}────┐\\n│        {{p2:visual-ref=S01-V01}}        │\\n└────{{p2:content-ref=S01-C01}}────┘\",\"layout_notes\":\"封面式结构，标题为第一层级，正文短句位于下方，中央预留概念示意区。\",\"purpose\":\"引出内容权威\",\"role\":\"cover\",\"slide_id\":\"S01\",\"text_footprints\":[{\"content_ref\":\"S01-TITLE\",\"estimated_lines\":2,\"font_family\":\"Microsoft YaHei\",\"font_file_sha256\":\"d79c55e68b1131eea0cc1c47be4f572d964f28c682e143db2ad09c1e4cb07a3f\",\"font_size_pt\":30,\"font_token\":\"title\",\"line_height_milli\":1200,\"max_lines\":2,\"min_height\":1567,\"preferred_width\":2000,\"role\":\"title\",\"safe_padding\":250,\"slide_id\":\"S01\",\"text_sha256\":\"7a2f52109fe720bba87fec490f62bd30b6d24f5e283b754b61e4ffa1f668f377\"},{\"content_ref\":\"S01-C01\",\"estimated_lines\":2,\"font_family\":\"Microsoft YaHei\",\"font_file_sha256\":\"d79c55e68b1131eea0cc1c47be4f572d964f28c682e143db2ad09c1e4cb07a3f\",\"font_size_pt\":20,\"font_token\":\"body\",\"line_height_milli\":1200,\"max_lines\":5,\"min_height\":1234,\"preferred_width\":2000,\"role\":\"body\",\"safe_padding\":250,\"slide_id\":\"S01\",\"text_sha256\":\"b4c6da0cf33d3d2fd15ba1c49fe158bbc9c3776a57f9771bea55663d2a37f6b4\"}],\"visual_placeholders\":[{\"role\":\"icon\",\"semantic\":\"内容规划\",\"semantic_source_refs\":[\"S01-TITLE\"],\"subtype\":null,\"visual_ref\":\"S01-V01\"}]}\n<<<END_SLIDE_DATA>>>\n\nReserve every Text Footprint as minimum clear space. Do not draw compositor-owned elements. Raster extraction candidates must be isolated, unoccluded, text-free, with minimum_short_edge=800 and safe_padding=300.",
      "element_intents": [
        {
          "source_ref": "S01-TITLE",
          "element_owner": "deterministic_compositor",
          "render_policy": "formal_text_overlay",
          "footprint_ref": "S01:S01-TITLE",
          "future_element_map_id": "EL-S01-TITLE"
        },
        {
          "source_ref": "S01-C01",